in March 1992 , Linux version 0.95 was the first to be capable of running X . This large version number jump was due to a feeling that a version 1.0 with no major missing pieces was imminent .	pieces	parts	bits	components	information	elements	items	component	part	sections
much of the water carried by these streams is diverted .	diverted	redirected	rerouted	changed	moved	separated	turned	altered	split	switched	veered	channeled	deflected
Harry also becomes the worthy possessor of the remaining deathly Hallows : the invisibility cloak and the Resurrection Stone , hence becoming the true Master of Death .	possessor	owner	holder	keeper	buyer	master	teacher
Escapologists escape from handcuffs , straitjackets , cages , coffins , steel boxes , barrels , bags , burning buildings , fish-tanks and other perils , often in combination .	perils	dangers	hazards	situations	danger	problems	fates	difficulties	risks	restraints	troubles
the storm continued , crossing the Outer Banks of North Carolina , and retained its strength until June 20 when it became extratropical near Newfoundland .	retained	kept	held	maintained	regained
the Convent has been the official residence of the Governor of Gibraltar since 1728 .	residence	home	house	dwelling	abode	owner	people
food is procured with its suckers and then crushed using its tough `` beak '' of chitin .	procured	obtained	gathered	gotten	grabbed	acquired	made	received	created	batten	secured	collected	processed	attained	found	aquired
the United States convened a 13-nation conference of the International Opium Commission in 1909 in Shanghai , China in response to increasing criticism of the opium trade .	convened	called	assembled	gathered	held	started	met	organized	made	opened	created	ordered	aggregated	hosted
photosynthesis is vital for life on Earth .	vital	important	necessary	needed	essential	required	critical	crucial
Dodd simply retained his athletic director position , which he had acquired in 1950 .	acquired	gotten	gained	received	got	obtained	achieved	taken	started	amassed	inherited
Radiometric dating is a technique used to date materials , usually based on a comparison between the observed abundance of a naturally occurring radioactive isotope and its decay products , using known decay rates .	abundance	amount	plenty	surplus	wealth	supply	bounty	excess	plenitude	profusion	outpouring	portion	growth	heap	availability	quantity
bacterial contaminants are ubiquitous , and foods left unused too long will often acquire substantial amounts of bacterial colonies and become dangerous to eat , leading to food poisoning .	substantial	large	significant	big	heavy	huge	great	many	major	copious	high	extensive
Tibooburra has an arid , desert climate with temperatures soaring above 40 Celsius in summer , often reaching as high as 47 C .	arid	dry	barren	desolate	moistureless
Hanna meandered around the southeastern Bahamas , weakening to a tropical storm while also dumping heavy rain on already-devastated Haiti .	meandered	wandered	drifted	walked	traveled	strolled	moved	blew	zigzagged	wondered	twisted	navigated	curved	went
with the high Gulf pressures - a ship reported a pressure of 1015.5 millibars less than 60 m from the storm center at the time it was upgraded to a tropical storm - Alicia was unable to gain size , staying very small , but generated faster winds , and became a Category 1 hurricane on August 16	generated	created	made	produced	built	powered	developed	formed	had	yielded	achieved
DAS Rheingold is the first of the four operas that comprise Der Ring des Nibelungen , by Richard Wagner .	comprise	form	contain	include	compose	includes	create	contains	cover	included	makes	agreed
a frenulum is a small fold of tissue that secures or restricts the motion of a mobile organ in the body .	secures	holds	fastens	locks	protects	fixes	tightens	stops	traps	limits	prevents	restrains	confines	guards	binds	keeps	ties	fixed	keep
Helen Hunt has been recognized extensively in her career . in 1998 she become the second actress to win a Golden Globe Award , an Academy Award and an Emmy Award in the same year .	career	job	work	life	profession	field	employment	honored	occupation
when Wotan refuses to abandon his `` free hero '' , Fricka lays bare his self-deception : Siegmund is in no sense independent since his fate has been pre-ordained by Wotan , who has even indirectly led him to find the magic sword .	refuses	declines	denies	avoids	doesn't	decline	doesn't want	fails	protests	ceases	refrain	declined	won't	stops	disagrees	denied	stopped	disallowed
the storm never approached land during its lifespan , and no damage or casualties were reported .	casualties	deaths	injuries	victims	accidents	fatalities
the purpose of public speaking can range from simply transmitting information , to motivating people to act , to simply telling a story .	transmitting	sending	giving	transferring	communicating	conveying	spreading	relaying	sharing	delivering	broadcasting	moving	passing	forwarding
published by Tor Books , it was released on August 15 , 1994 in hardcover , and in paperback on July 15 , 1997 .	released	sold	available	delivered	distributed	issued	sent	published	provided	given	opened	initiated	created	dispensed	premiered	dispersed	revealed	launched	dropped
in many circumstances , these investments can be less expensive than fossil fuel energy systems .	circumstances	situations	cases	instances	ways	events	scenarios	examples	times
following the death of Schidlof from a heart attack in 1987 , the Amadeus Quartet disbanded .	disbanded	separated	dissolved	ended	split	quit	stopped	scattered	died
by 1960 he had developed the short story into a screenplay , and envisaged it as containing a suitable role for Monroe .	envisaged	imagined	saw	pictured	envisioned	anticipated	good	considered	conceived	featured	predicted	seen
with poor sales of the A340-200 , Airbus decided to use the fuselage of the A340-200 with the wings and engines of the A330-300 .	fuselage	body	cabin	frame	bulk	tank	front	core	mass	center	trunk
the last event was held on June 11 , 2000 , not to be held again due to the acquisition of WCW by World Wrestling Federation .	acquisition	purchase	gain	gaining	buying	addition	ownership	receiving	obtaining	attainment	acquirement	attaining
Kowal suggested the name and the IAU endorsed it in 1975 .	endorsed	supported	approved	accepted	backed	okayed	authorized	favored	recommended	passed	adopted	ratified
dry air wrapping around the southern periphery of the cyclone eroded most of the deep convection by early on September 12 .	periphery	edge	border	side	outside	part	end	outskirts	surroundings	circumference	rim	edges	area
brief additional internal links are generally tolerated when used to facilitate communication or to provide general information , but undesirable if seen as canvassing for some purpose .	tolerated	accepted	allowed	okay	bared	acceptable	used	endured
Alfonso drops the marriage contract in front of the officers , and , when they read it , they become enraged .	enraged	angry	angered	mad	furious	upset	infuriated
the overland expedition , also called the overland Relief expedition or Point Barrow-Overland Relief expedition , was an expedition in the winter of 1897-1898 by officers of the United States Revenue cutter Service to save the lives of 265 whalers trapped in the Arctic Ocean by ice around their ships near Point Barrow , Alaska .	expedition	journey	trip	adventure	voyage	quest	mission	trek	undertaking	outing	tour	exploration	excursion
located on the River Pedieos and situated almost in the center of the island , it is the seat of government as well as the main business center .	situated	located	placed	positioned	sitting	fixed	established	settled	settles	based	at
Iero thought that it would be difficult to promote the album himself , if released through his own label , with his current obligations to My Chemical Romance and the other bands signed to his label .	obligations	duties	commitments	responsibilities	ties	promises	requirements	responsibility	commitment	agreements	duty	business	debts	loyalty	connections	promise	debt
it has now been determined that Europa is a prograde rotator , but the exact direction in which its pole points remains ambiguous .	ambiguous	unclear	unknown	uncertain	vague	unsure	random	indeterminate	cloudy	hidden	confusing
the Bishops ceded the Oversticht to the Emperor Charles V in 1528 , who styled himself `` Lord of Overijssel '' , thereby giving the province its modern name .	ceded	gave	surrendered	yielded	abandoned	transfer	granted	assigned	allowed	detached	left
many parts of Odessa were damaged during its siege and recapture on 10 April 1944 , when the city was finally liberated by the Red Army .	siege	attack	capture	blockade	battle	surrounding	takeover	invasion	raid	holding	blockage	fighting	barricade	storming	storm	conquer	hold	war
the city was first founded by the British in 1827 , who leased the island from Spain during the colonial period .	leased	rented	borrowed	loaned	secured	let	gave
in reference to the landscape , bush describes a wooded area , intermediate between a shrubland and a forest , generally of dry and nitrogen-poor soil , mostly grassless , thin to thick woody shrubs and bushes , under a sparse canapy of eucalypts .	sparse	thin	small	limited	few	scattered	skimpy	light	bare	scant	little	slim
the theory of incentive compatibility that Hurwicz developed changed the way many economists thought about outcomes , explaining why centrally planned economies may fail and how incentives for individuals make a difference in decision making .	incentives	rewards	motivations	bonuses	awards	benefits	motives	bribes	prizes	motivation	bait	gift	stimulants	encouragements	goals	baits	temptations	boost	payments
the axe , or ax , is an implement that has been used for millennia to shape , split and cut wood , harvest timber , as a weapon and a ceremonial or heraldic symbol . the axe has many forms and specialized uses but generally consists of an axe head with a handle , or helve .	implement	tool	instrument	device	item
but critics note that Francis Galton did not advocate coercion when he defined the principles of eugenics .	advocate	support	promote	suggest	endorse	allow	like	for	state	favor	encourage	want	recommend	apply	cause	speak
after its sale in 1998 , it merged into Festival mushroom Records .	merged	combined	joined	formed	turned	changed	blended	united	mixed	absorbed	converged	grew	fused
Cobra and tango and Cash did solid business domestically but overseas they did blockbuster business grossing over $ 100 million in foreign markets and over $ 160 million worldwide .	grossing	earning	making	gaining	totaling	bringing	getting
triangles can also be classified according to their internal angles , measured here in degrees .	classified	grouped	organized	categorized	sorted	named	arranged	defined	described	separated	divided	identified	labeled	coded	listed	called
later describing the experience as a `` nightmare , '' she was able to phone Joe DiMaggio from the clinic , who immediately traveled from Florida to New York to facilitate her transfer to the Columbia Presbyterian Medical Center , where she remained for three weeks .	facilitate	help	ease	aid	assist	start	expedite	enable	complete	oversee	allow	escape	further	arrange	orchestrate
the Pennines constitute the main watershed in northern England , dividing the eastern and western parts of the country .	constitute	are	form	make	frame	compose	controlled	complete	brand	allow	contain	embody	include	makes	create	comprise
they locate food by smell , using sensors in the tip of their snout , and regularly feast on ants and termites .	snout	nose
at present it is formed by the AA , which descends from the Rigi and enters the southern extremity of the lake .	extremity	end	part	edge	border	boundary	tip	depth	farthest	area	section	point	outside	sides	portion	limb	arm	leg	side
specialized English operates in the civil society sector , and the developers aspire to make programs for a variety of public service purposes , subject to resources being available .	aspire	hope	try	dream	aim	want	strive	seek	desire	intend	wish	crave	plan	hopes
in this case , a relatively large kernel with sophisticated capabilities is adapted to suit an embedded environment .	sophisticated	complex	advanced	fancy	complicated	smart	sharp	many	refined	cultured	exceptional	better	experienced	enhanced	high	elegant	various	mature	tech	special
this period spanned the years from 1278 through 1288 .	spanned	covered	lasted	extended	ranged	used	involved	covers	connected	stretched	bridged	included	was
realising that the gang could not elude the police forever , Moondyne Joe formulated a plan to escape the colony by traveling overland to the colony of South Australia .	elude	avoid	escape	evade	dodge	trick	puzzle	ditch	outrun	lose
southeastern Oklahoma , also known by its official tourism designation , Kiamichi Country , encompasses the southeastern quarter of the state of Oklahoma .	encompasses	includes	surrounds	covers	contains	circles	encircles	spans	fills	is	occupies	forms	place	envelopes
the A-train family comprises trains for both commuter services and limited express services .	comprises	includes	contains	has	makes	is	harden	include	involves	made	produces
in DNA , adenine binds to thymine via two hydrogen bonds to assist in stabilizing the nucleic acid structures .	binds	attaches	sticks	connects	adheres	holds	joins	ties	combines	clings	links	bonds
in 2001 , UNESCO inscribed the 2,750-year-old city on the World Heritage List as Samarkand - Crossroads of Cultures .	inscribed	wrote	registered	added	recorded	named	marked	etched	put	endorsed	listed	carved	dedicated	inducted	dubbed	designated	written	labeled	included	entered	engraved
Radames affirms that Aida is the person he will marry , and Aida convinces him to flee to the desert with her .	affirms	agrees	confirms	says	states	declares	promises	swears	attests	repeats	decides	again	announces	support	validates	assures	asserts	guarantees	acknowledges
like many Bolshevik artists , Eisenstein envisioned a new society which would subsidize artists totally , freeing them from the confines of bosses and budgets , leaving them absolutely free to create , but budgets and producers were as significant to the Soviet film industry as the rest of the world .	envisioned	imagined	saw	pictured	dreamed	visualized	foresaw	conceptualized	viewed
forming in the western Caribbean sea during the first week of November , Hurricane Gordon became the twelfth tropical depression , the seventh named tropical storm , and the third hurricane of the 1994 Atlantic hurricane season . an erratic , long-lived system which remained a tropical storm for most of its existence , it followed a winding path through the western Caribbean and into Florida before strengthening into a Category 1 hurricane and threatening North Carolina .	erratic	unpredictable	crazy	unusual	chaotic	wild	unstable	varied	irregular	oddball	uncertain	odd	random	strange	foreseen	uneven	wavering	not	wandering
the latter means basic or radical change ; whereas reform may be no more than fine tuning , or at most redressing serious wrongs without altering the fundamentals of the system .	altering	changing
the Kyoto Protocol was adopted at the third session of the Conference of Parties to the UNFCCC in 1997 in Kyoto , Japan .	adopted	accepted	chosen	used	signed	selected	embraced	approved	started	passed	on	initiated	assumed	supported	ratified	decided	instated
from 1885 to 1901 , locomotives stopped at Young Tank to replenish their water .	replenish	refill	resupply	fill	reload	renew	gather	re-up	replace
stone floor tiles tend to be heavier than ceramic tiles and somewhat more prone to breakage during shipment .	prone	likely	susceptible	subject	vulnerable	apt	liable	inclined	disposed	open	easier	able	probable	incline
to enjoy Qin songs , one must learn to become accustomed to the eccentric style some players may sing their songs to , like in the case of Zha Fuxi .	eccentric	odd	unusual	unique	strange	different	weird	crazy	bizarre	uncommon	fancy	wild	quirky	abnormal	wacky	varying
a voluntary association or union is a group of individuals who voluntarily enter into an agreement to form a body to accomplish a purpose .	accomplish	achieve	complete	fulfill	finish	do	serve	reach	carry	finis	out	attain	make
it is the teaching that , as a consequence of the Fall of Man , every person born into the world is enslaved to the service of sin and , apart from the efficacious or prevenient grace of God , is utterly unable to choose to follow God or choose to accept salvation as it is freely offered .	efficacious	effective	active	powerful	capable	productive	efficient	strong	generous	useful	helpful	power	successful	effect	valuable	influential	impelling	potent	kindness	ever	present	showy
he was kidnapped and held by the notorious Pirate Peter Easton in Harbour Grace .	notorious	infamous	famous	evil	well-known	known	mean	flagrant	well	bad	shameful	legendary	popular	wicked	ill-famed	feared
as a result of this acquisition and the legal dispute with Hearst Corporation , Mandrakesoft announced that the new company name would be Mandriva , and that Mandriva Linux would be the new name covering products .	dispute	argument	fight	disagreement	battle	debate	conflict	complaint	differences	gain	trouble	issue	problem	confrontation
despite almost daily reports of missing property , he was able to evade capture until 15 February , when a man named Wimbow , who had been pursuing him with a partner for days , found him in an area of thick brush called Liberty Plains and shot him .	evade	avoid	escape	dodge	elude	not	be
he was born at Plessiel , a hamlet of Drucat near Abbeville , to a long-established family of Picardy , the great-nephew of the painter Eustache Le Sueur .	hamlet	village	town	community	suburb	division	neighborhood	district	house	place	small
the Man in the High Castle occurs in an alternate universe United States ruled by the victorious Axis powers .	alternate	different	other	another	opposite	parallel	separate	imaginary	recurrent	variant	varied	mirror
their quick acceleration makes them suitable for services with short intervals between stations .	suitable	appropriate	acceptable	good	useful	okay	fitting	usable	apt	fit	ideal	perfect	convenient	applicable	excellent
Aung San Suu Kyi returned to Burma in 1988 to take care of her ailing mother .	ailing	sick	ill	sickly	dying	suffering	distressed	sickening
progress in developing the TAR was hindered by political and economic obstacles throughout the 1960s , 1970s and early 1980s .	obstacles	problems	barriers	hurdles	challenges	difficulties	blocks	blockages	issues	setbacks	hindrances	barrier	difficulty	troubles	interference	obstructions	bumps	distractions	hurdle	lows	dangers	items	hoops	hardships
in 1832 his family emigrated thence to Belleville , Ontario , where he apprenticed with the printer at the town newspaper , The Belleville Intelligencer .	emigrated	moved	came	migrated	traveled	departed	left
Ohio State also announced in 2006 , that it would be designating at least $ 110 million of its research efforts to what it termed `` fundamental concerns '' such as research towards a cure for cancer , renewable energy sources and sustainable drinking water supplies .	fundamental	basic	important	major	primary	core	vital	central	money	crucial	critical	main	essential	principal
long ago , there was a decision by the late former Prime Minister , Rafik Hariri , to restore the synagogue and surround it with a garden .	restore	fix	rebuild	repair	revive	renovate	remake	save	redo	remodel
port Arthur was also the destination for juvenile convicts , receiving many boys , some as young as nine arrested for stealing toys .	juvenile	young	child	underage	younger	adolescent	under-age	childish	youth	children	minor	kid
Notrium is played from a top-down perspective , giving an overhead view of proceedings .	perspective	view	viewpoint	point-of-view	angle	outlook
the International re-formed in 1923 , and was reconstituted again , in its present form , after World War II .	reconstituted	rebuilt	remade	reformed	formed	recreated	restored	reorganized	reestablished	restarted	revived	renewed	built	redeveloped	reinstated	created	reconstructed	redone	rewritten	allowed	recomposed	copied	fixed	reworked
the Amazon Basin is the part of South America drained by the Amazon River and its tributaries .	tributaries	streams	branches	rivers	channels	ditches	offshoots	creeks	brooks	adjacent
the Sunnah is seen as crucial to guiding interpretation of the Qur ` an .	crucial	important	vital	necessary	essential	critical	needed	key
the Avesta is the primary collection of sacred texts of Zoroastrianism , composed in the Avestan language .	composed	written	made	created	collected	constructed
typically , the biggest difference between film and stage musicals is the use of lavish background scenery which would be impractical in a theater .	lavish	fancy	extravagant	rich	expensive	plentiful	elaborate	generous	impressive	detailed	garish	flamboyant	excessive	splendid	gaudy	big	lush	luxurious	complex	complicated	lively	pretty	grand	wild	extensive	special	nice
following The hassles ' demise in 1969 , he formed the duo Attila with hassles drummer Jon Small .	demise	death	breakup	fall	end	downfall	failure	decline	fate	ending	ended	crumble	destruction
there they signed a collective protest , and vowed their newspapers would continue to run .	vowed	promised	swore	pledged	assured	declared	said
the first amniotes , such as Casineria , resembled small lizards and evolved from amphibian reptiliomorphs about 340 million years ago .	resembled	mirrored	matched	match	mimicked	features	emulated	appeared	were	doubled	duplicate	echoed	mirror	matching
in 1999 , a World Tamil Confederation was established to protect and foster Tamil culture and further a sense of togetherness amongst Tamils in different countries .	foster	support	promote	nurture	grow	encourage	cultivate	help	raise	advance	protect	uphold	started	adopt	serve	accommodate	care	previous
for much of the twentieth century it was used by the Queensland Government as a settlement for Aboriginals considered guilty of such infractions as being `` disruptive '' , being pregnant to a white man or being born with `` mixed blood '' .	infractions	crimes	violations	offenses	errors	disturbances	charges	penalties	wrongdoings	faults	rules	trouble	vices	laws
historically , in the warm Mediterranean and Middle Eastern climates , the courtyard served to accommodate the large number of worshippers during Friday prayers .	accommodate	hold	house	aid	fit	support	accept	gather	shelter	holds	serve	host	contain	lodge
John McCain polled 62.5 % in the 2008 Presidential Election while 70.9 % of Utahns opted for George W. Bush in 2004 .	opted	voted	chose	decided	went	choose	selected	marked	hoped	elected	preferred	settled
throughout most of the film , his only true friend , aside from his mother , is the mouse , Timothy - a relationship parodying the stereotypical animosity between mice and elephants .	animosity	hatred	dislike	hate	tension	hostility	unfriendliness	enmity	bitterness	fighting	anger	problem	difference	rivalry	conflict
the band is known for its large line-up , which consists of nine members ; including a vocalist , two guitarists , a bassist , two percussionists in addition to a primary drummer , a sampler , and a turntablist .	vocalist	singer
digital signatures are equivalent to traditional handwritten signatures in many respects ; properly implemented digital signatures are more difficult to forge than the handwritten type .	forge	fake	copy	create	make	duplicate	recreate	falsify
his linguistic capacity , thoughts and speeches correspond to those of modern man , including a vast knowledge about history , politics , philosophy and literature .	vast	large	great	wide	huge	broad	voluminous	boundless	deep
recent archaeological evidence may indicate an Edomite nation as long ago as the 11th century BC , but the topic is controversial and others argue that the 8th or 9th century dates are correct .	evidence	proof	findings	clues	facts	data	discoveries	finds	items	indication	verification	records	signs
Triton was revealed to have remarkable active geysers and polar caps .	remarkable	amazing	incredible	extraordinary	great	impressive	awesome	interesting	beautiful	real	unusual	outstanding	very	noteworthy	notably	huge	wonderful	significant	exceptional	super
polar bear fur consists of a layer of dense underfur and an outer layer of guard hairs , which appear white to tan but are actually transparent .	transparent	clear	translucent	colorless
the most common reason for erecting a khachkar was for votive reasons - for the salvation of the soul of either a living or a deceased person .	deceased	dead	building
scene 2 : the Doctor rushes by the Captain in the street , who urges him to slow down .	urges	tells	asks	begs	encourages	wants	suggests	convinces	asked	forces	desire	presses	demands	suggest	persuades	provokes	warn	desired	encourage	spurs
Warner also set a Super bowl record by attempting 45 passes without a single interception .	attempting	trying	throwing	pursing	tried	make	try	pursuing	making
a carotenoid dye , crocin , allows saffron to impart a rich golden-yellow hue to dishes and textiles . Saffron has further medicinal applications .	golden-yellow	yellow	gold	yellowish	golden	sunshine	orange	marigold	bronze	amber	lemon-like	goldenrod	ochre	colored
the revival of lute in the 20th century revitalized the interest of composers in the instruments of the lute family .	revival	rebirth	return	comeback	renewal	awakening	recovery	restart	reuse	comback	reemergence	reintroduction	reformation	remake	restoration
Urepel is a commune in the Pyrnes - Atlantiques department in south-western France .	south-western	southern	lower	southwest	south	south-west	lower-left	part	sw	western	bottom
