they should take note of Darius ' admonitions. -- Well I think this is ok because they 're part of your race and therefore part of your extended family .	therefore	so	accordingly	thus	hence	consequently
the same is true if you are using internet newspaper sites : some media outlets can be worthy sources of information and analysis and others are not .	worthy	trusted	excellent	deserving	deserved	reputable	commendable	laudable
we are so profoundly ignorant in these matters , so far from anything worthy of the name of science , that one view is just as permissible and just as untrustworthy as the other .	worthy	deserved	deserving
but there has been a good campaign fought by all the candidates and I would like to think that a person taking his place in this House in the next week or two will be a worthy representative of the residents in North Vancouver .	worthy	respectable	deserving	deserved	admirable	creditable	laudable
NICOLSON : 1 do n't think that anyone has suggested that in a good number of these amounts , the money is not going toward worthy causes .	worthy	charitable	deserving	righteous	deserved	laudable
Thirty-three-year-old Delahaye was a popular figure in the Paris office and was talked about as a worthy successor to Robert Capa .	worthy	acceptable	fitting	deserving	deserved	satisfactory	admirable
but I pictured Carolyn looking just as slender and elegant , appearing at benefits for worthy causes .	worthy	charitable	deserving	fitting
but overall , it makes for worthy listening on a good sound system .	worthy	good	excellent	worthwhile	deserved	commendable	admirable
it means knowing and loving ourselves enough to open the doors to allow a higher understanding of what the idle half our minds are capable of doing , disciplining ourselves to use the gifts accurately , for worthy purposes .	worthy	worthwhile	beneficial	deserving	honourable	commendable	creditable
if babydaddy says he wo n't be around for the kid if you are n't sleeping with him , or you fear he wo n't , ask yourself if he 's a worthy boyfriend OR father .	worthy	suitable	worthwhile	deserving	befitting
we fork over cash for all sorts of less worthy things .	worthy	suitable	worthwhile	commendable	deserving
thus , the analyst acquires knowledge about the nature of the patient through an awareness of something going on in him .	acquires	collect	gather	gain	acquire	amass
a subsidiary was floated in the UK , Tata Tea ( GB ) Ltd. , which acquired the controlling interest in the Tetley Group .	acquired	gained	purchased	bought	obtained	procured
with the Offer now completed , 2016091 Ontario Inc. will proceed with further steps to acquire the remaining IXOS shares not owned by it , in accordance with German law .	acquire	buy	get	purchase	gain	obtain	procure
teacher education students will acquire the knowledge and skills required to apply current and emerging educational technologies both as teachers in training and as practicing teachers .	acquire	receive	gain	obtain	amass
how many times have I caught up with those people several years later , to discover that they have acquired a lifestyle , a car and a mortgage to match their salary , and that their initial ideals have faded to the haziest of memories , which they now dismiss as a post-adolescent fantasy ?	acquired	gotten	obtained	gained	achieved	procured
then judge whether you already have these skills in some form or could reasonably acquire them before retirement .	acquire	learn	gain	get	secure	obtain	amass
thank you for having Osiris here . We 've been involved in mesenchymal stem cell , adult stem cell research for about 11 years now . Our technology came out of Arnie Kaplan 's lab and was acquired from Case Western at that time , and we 've been solely focused in that area since on several applications .	acquired	gained	bought	obtained	purchased	procured
provides counseling , education and advocacy programs which help area residents acquire and retain/maintain safe and affordable housing .	acquire	buy	find	get	purchase	obtain	gain	procure
more than 200 of the most significant works acquired by the Corning Museum of Glass during the 1990s , to augment its holdings of 35,000 objects , are featured here .	acquired	purchased	bought	obtained	procured
yet the last four are unattainable , the narrator insists , if you ca n't acquire the personal security -- the `` inner core , `` says Covey -- that presumably comes from a mastery of the foundation .	acquire	gain	get	obtain
Anointing of the sick may be repeated if the person becomes ill again or the danger becomes more acute .	acute	serious	severe	critical	grave	sharp
using occasional case studies , Cutler defines her terms and provides specific examples of acute and chronic allergens causing asthma and allergic reactions and the genetic , environmental , metabolic , and little-known causes that play roles in asthma onset .	acute	serious	severe	urgent	sudden
patchwork solutions produced by the personality ethic are like painkillers for an acute disease ; the problems might be temporarily hidden , only to return later with a vengeance .	acute	serious	severe	critical
hands , in particular , seem to be acute Qi detectors and transmitters .	acute	sensitive	sharp	serious	keen
recommendations Regards less of inappropriately placed patients in acute hospitals and the difficulties associated in placing these patients we estimate that the equivalent of a fully resourced general hospital ( 130million ) is taken up by p atients who have suffered from preventable error .	acute	urgent	severe	emergency	critical
coronavirus as a possible cause of severe acute respiratory syndrome .	acute	critical	pn
by sheer personal determination he raised the subject of psychic phenomena into the arena of acute controversy -- and kept it there .	acute	serious	intense	heightened	severe
ISIS-3 : a randomised trial of streptokinase vs tissue plasminogen activator vs anistreplase and of aspirin plus heparin vs aspirin alone among 41,299 cases of suspected acute myocardial infarction .	acute	serious	severe
`` generous Chinese loans ' The best recovery that money can buy ' For all its fragilities , nothing yet has slowed this fire-breathing dragon - not the Asian financial crisis of 1997-'98 ; not the Internet and technology crash ; not synchronous global recession of 2001 ; and not this year 's outbreak of severe acute respiratory syndrome , or SARS .	acute	critical	pn
does this woman have an acute uncomplicated urinary tract infection ?	acute	serious	severe
wherever the AZT caravan stopped , it presented physicians from important metropolitan centres like London and New York .	caravan	band	trailer	vehicle	roadshow	company	cavalcade
your trailer or caravan must be fitted with an approved style number plate .	caravan	camper
if you sat facing Cologne you could n't see the chimney stacks further up the river , if you squinted you could n't see the caravan park on the other side , if you drank enough weisse weijn the thronging day-trippers greyed-themselves out .	caravan	camper	trailer	camping
tent , caravan or campervan . Make sure of your future work plans before you move on from your present location .	caravan	camper	trailer
you might think of several caravans of trucks all using the same road system to carry materials .	caravans	groups	convoys	cavalcades
the town is also well known as a transit point for the camel caravans bringing salt up from the arid lands of the Dankal Depression .	caravans	travels	parties	trains	companies	convoys	cavalcades
in his distress of mind at being left behind by the caravan , he had not noticed where he had thrown the load .	caravan	troop	trailer	company	convoy
about the time that Ross , Trudo , and Benware were beating Tipton senseless , the three-vehicle caravan , led by the Blazer , with defendant as the driver and Harris as a passenger , pulled into the parking lot .	caravan	camper	company	convoy	cavalcade	crocodile
lazy Lizard caravan Park , Pine creek Small and nondescript caravan park behind the Pine creek Tavern , off the Stuart Highway .	caravan	camper	trailer
directly away from where the caravan was headed . : : : Yang watched the exchange with interest .	caravan	trailer	company	convoy	convey	cavalcade
to understand why this should have been so , we need to look more closely at the nature of the style and its origins .	closely	carefully	intently	attentively	scrupulously
some people have guessed that this radiation is closely related to a period of intense cold and a high level of ice cover occurring around 600 mya ; perhaps environmental stresses wiped out competitors and created opportunities for a ( relatively ) clever animal to succeed and proliferate .	closely	nearly	strongly	directly	intimately
they are working closely with Natural Tunnel State Park , where the staff , eager to have additional housing nearby , have assured the Bakers that they will be booked on a regular basis since the demand for housing outweighs supply .	closely	together	jointly	intimately	collectively
the Department is also working closely with hm Customs and Excise who are in the lead on developing the national lorry road user charging scheme .	closely	together	jointly	intimately	collectively
retail : in the U.S. , analysts will be looking closely at third-quarter results .	closely	carefully	attentively	intently
their academic careers are closely intertwined with social and political developments such as secularisation and antisemitism .	closely	strongly	neatly	narrowly	intimately
`` the baby has developed very normally and has been followed closely .	closely	carefully	attentively	intently
to prevent asthma episodes you will have to work closely with your doctor to : develop a medicine plan that keeps you from getting symptoms .	closely	carefully	together	jointly	alongside
problems are flagged quickly and , working closely with your staff , we propose solutions .	closely	together	carefully	jointly	intimately
what women want on A first date ( updated Thursday , Dec 5 , 2002 , 02:06:55 PM to reflect the 100 most recent valid responses. ) assuming you are a woman , which most closely matches your idea of a great first date ?	closely	nearly	approximately
but that last statistic is misleading , because a variety of studies shows that about 40 % of the workers who do n't take up healthcare offers have coverage through a spouse , and another 20 % ( likely younger workers ) decline coverage to save money .	decline	refuse	reject	forgo
in an interview for this survey , Gordon Brown , the British chancellor and himself a Scotsman , said that support for the SNP declined as the election neared because the party failed to give convincing answers to big questions about how it would run Scotland 's economy .	declined	fell	dropped	decreased	rejected	lessened	weakened
St. Lawrence cement increased domestic cement deliveries , but on balance volumes declined owing to delivery bottlenecks in the northeastern US .	declined	fell	dropped	decreased
the Air Force has experienced low levels of equipment availability in the last five years , and availability of the Hercules and the Aurora fleets continues to decline .	decline	drop	fall	decrease	deteriorate
high school non-completion rates continue to decline 5 and an increasing number of young people are pursuing post-secondary education 6 .	decline	drop	fall	decrease	deteriorate
whenever there is a condition with results in cardiac dysfunction stroke volume will eventually declined .	declined	fell	dropped	decreased
the productivity of crops and pastures , as well as the health of other vegetation , declines as the saline watertable reaches their root zones .	declines	drops	falls	decreases
unhappy with being called to task for declining scores , political educators complained that the tests were unfair to some , so they watered them down - - as if 2+2=4 was being challenged as unfair on racial , gender or other social-oriented measures .	declining	falling	decreasing	deteriorating
in particular , per capita incomes in Africa have declined relative to the industrial countries and in some countries have declined in absolute terms .	declined	fallen	dropped	decreased
the GARCH model is an infinite order arch model with a geometrically declining set of weights .	declining	falling	reducing	decreasing
i will not endure the laughter of the Court .	endure	suffer	tolerate	bear
and this combined annual incidence-rate will endure indefinitely too , until the annual production-rate is altered .	endure	continue	last
positive attitude overcomes pelvic pain Former athlete Janet H has endured 20 operations and has been reduced to surviving on a special liquid diet after being stricken 24 years ago with endometriosis .	endured	had	suffered	experienced	undergone
what was n't my fault was the ordeal I had to endure to fix it .	endure	suffer	undergo	tolerate
developers are routinely asked to endure the hardships of design extremes , such as a low-memory footprint , in order to reduce total system cost .	endure	suffer	bear	undergo	tolerate
the White SOx , who are enduring what I call the Curse of the 1919 Black SOx ?	enduring	having	experiencing	suffering	undergoing
and , to a large extent I have Harvard to thank for that -- for the extraordinary role models I studied and studied under and the friendships I made that have endured .	endured	continued	lasted	persisted
now here he is , gowned and on a gurney , forced to endure a medical procedure all because of some soup .	endure	have	suffer	undergo
however , people often endured inadequate AT because of the lack of a viable alternative .	endured	underwent	experienced	suffered
the campaign should challenge the notion that prostate problems are an inevitable part of ageing to be endured rather than investigated .	endured	tolerated	suffered	borne
the Hispanic FAMILY : an untapped resource One step that schools can take is to understand and tap into an important and underutilized source of strength -- the Hispanic extended family .	extended	wide	expanded	additional	broad
) and recording an extended soundcheck on a little tape machine that may end up playing a big role on our next record .	extended	long	lengthened	prolonged	protracted
discussion top In this study , we have shown that recombinant gp120 increases the permeability of brain endothelium cultures to albumin , most likely by altering the cell morphology and inducing extended intercellular gaps that allow passage of macromolecules and probably facilitate cell transmigration across the BBB .	extended	increaseed	longed	exteneded	lengthened	enlarged	elongated
nuclear Family This unit observes and assesses the effectiveness of childcare in the nuclear family home environment , looking at the childrens ' experience with their parents and extended family .	extended	additional	wide	expanded	broad
at work : calling in sick , coming in late , leaving early , taking extended breaks , giving up your territory ( `` Why do n't you let Mary take over that assignment for you `` ) .	extended	long	lengthy	lengthened	protracted	prolonged
( grieve 1927a , 19 ) [ 9 ] This book therefore marked the beginning of what was to be an extended battle between MacDiarmid , as well as the other Celticist fundamentalists in the NPs , and the conservative nationalists of the Scottish Party .	extended	lengthy	long	protracted	prolonged
not surprisingly , Ellison spends a considerable amount of time describing the results of his own extended fieldwork among Efe hunter-gatherers and Lese horticulturalists living in the rainforests of the Democratic Republic of Congo .	extended	lengthy	extensive	comprehensive	expansive	prolonged
extended warranties for desktop computers tend to be rip-offs , because you would usually pay an independent technician much less in repair costs over the same period that a typical extended warranty costs to provide repair cover .	extended	exteneded	lengthened	longed	additional	increaseed	expanded	augmented
I 've always been kind of at loose ends whenever I 'm given an extended period of free time .	extended	long	lengthy	prolonged	protracted
i was taking a prescription medication over an extended length of time under the supervision of a physician who specializes in the management of pain .	extended	lengthy	prolonged	long	protracted
this external communication could be with external trading partners or within the organization .	external	outside
that is , we can be glad so long as we do not believe in external authority ( for example , the testimony of others ) alone for our religious beliefs .	external	outside
the external appearance of each type of extinguisher maybe different and each carries its own instructions for use .	external	outside	outer	outward
external resources : assess external resources and the community 's institutional , political , technical , legal and fiscal capability to engage in hazard mitigation and response .	external	outside	nonlocal
Q Can you kindly advise if Team roles change with different team members and external factors e.g . company setting , cultural context ?	external	outside
external links to other Internet sites should not be construed as an endorsement of the views or privacy policies contained therein .	external	outside	link
when careful measurements are taken of current flows in the generator and in the external circuit , evidence suggests that electric charges are appearing at the periphery of the generator and disappearing at the center of the generator that do not actually pass through the generator .	external	outside	outer	exterior
many spiritual traditions still eschew technological techniques in favor of more `` authentic `` ones ; so unassisted meditation is said to be better than use of mind machines , electronic biofeedback , or psychotropic chemicals , and the use of technology as a sign of attachment to `` worldly `` things or reliance on external crutches rather than `` self-realization .	external	outside	outer	exterior
`` nothing came to our attention indicating evidence of influence or pressure from internal or external sources , `` he wrote .	external	outside	exterior
the end of the Cold War could not but sharply increase its international isolation and legitimacy deficit ; bartering its anti-communist credentials for external assistance was no longer a feasible option .	external	outside	foreign
the emancipation of women can only be completed when a fundamental transformation of living is effected ; and life-styles will change only with the fundamental transformation of all production and the establishment of a communist economy .	fundamental	essential	basic	radical	elemental	intrinsic
but as the approach moves into the commercial realm , especially the software business , it 's challenging fundamental notions about who owns ideas and how best to foster innovation .	fundamental	primary	basic	essential	significant	elemental
the occasion is often a personal failure of fundamental understanding , where understanding transcends the grammar of associative consciousness .	fundamental	basic	elementary	essential	foundational	elemental
first , he clearly distinguishes norms or values within the social network as having a fundamental impact on the development of social capital .	fundamental	basic	major	important	central	significant	elemental
`` We 're trying to build things that work and to prove theorems about why they work.We 're trying to articulate the more fundamental concepts of the field . '' Koditschek mentions Alan Turing , who in the early 20th century first envisioned machines capable of methodical , goal-directed computation .	fundamental	basic	elementary	foundational	essential	elemental
two of the fundamental limitations of northern EIAs are the lack of adequate ecological baseline data and the lack of an adequate framework or method to link ecological and social components of the environment .	fundamental	basic	important	vital	elemental	significant	essential
we generally do not permit transferral into the second year due to the unique nature of our course and fundamental skills that are learnt in the first year , but you are welcome to discuss your case with the admissions Tutor .	fundamental	basic	essential	foundational	vital	elemental
would you rather have made the camera that shot Citizen Kane , or make Citizen Kane ? '' Silicon alley is unique , but the fundamental processes that have facilitated its emergence are not .	fundamental	basic	important	essential	foundational	underlying	significant	elemental
they will also support two fundamental instructional objectives .	fundamental	necessary	basic	essential	foundational	elemental
the training demands outlined above ; the needs of governors for trained , well-led , and appropriately organized forces to defend against terrorist threats ; and possible political pressures not to deploy some ARNG units during times of heightened terrorist threats will demand a fundamental reexamination of Army organization .	fundamental	basic	elementary	radical	foundational	elemental
to facilitate that involvement , the University will maintain appropriate processes within which students can communicate their views by formal and informal means , and can , directly or through their representatives , actively contribute to decisions affecting the University community .	informal	unofficial	relaxed	casual
this is one of the most important areas of informal employment and can take place in home-based , micro-enterprise-based or in factory-based locations .	informal	unofficial	relaxed	casual
there are also quite a number of informal barriers .	informal	unofficial	everyday	relaxed	ordinary
for instance , COPLs generally provide interface specifications ( formal or informal ) for classes by running a tool such as Javadoc or Eiffel 's ' short ' over the class definition , meaning that the poor person writing a class has to write to 4 different ' audiences ' at once : the compiler , people writing code that uses the class , people writing derived classes and people maintaining the class itself .	informal	relaxed	casual	approximate	imprecise
institutions can be informal or formal .	informal	unofficial	relaxed	casual
things continued on an informal , personal basis , by phone , I [ remained ] close friends with two of them , but Izzat al Gazawi died last year .	informal	relaxed	casual	friendly
schoolyard Habitats - National Wildlife Federation - Offers an array of resources and programs for formal and informal K-12 educators in a traditional classroom situation , nature center or other youth service facility .	informal	friendly	casual	relaxed	spontaneous
since kt is the established symbol for the kilotonne , KN is the best choice as a symbol for the knot . knot [ 2 ] an informal unit of distance equal to the nautical mile .	informal	unofficial	everyday	casual
Jeffs and Smith suggest that informal educators are `` guided ... by their understanding of what makes for the good ; of what makes for human well being '' ( 1990 : 1 7-1 8 ) .	informal	untrained	relaxed	casual	spontaneous
key findings are available in the informal education archives : ; full report : `` Institute of Public Policy Research 2003 reprinted here with the kind permission of the Institute of Public Policy Research First placed in the archives : December 2003	informal	unofficial	easygoing	casual
the investigators , all part of a team known as the Antithrombotic Trialists ' Collaboration ( ATC ) , looked at whether the antiplatelets cut patients ' risk of heart attack , stroke and death from a cardiovascular cause .	investigators	researches	experiments	examines	inquiries
Reilly says he lost interest in the phone tap after finding in the wastebasket a piece of carbon paper with the impression of 15 questions which Otepka had allegedly typed out for Senate investigators to ask Reilly .	investigators	detectives	officials	offices	inspectors	inquiries
`` [ new York Times , 9/11/02 ] OCT 5 , 2002 : Congressional investigators say the FBI 's efforts to block their inquiry makes them skeptical of FBI assertions .	investigators	detectives	officials	inspectors	offices	inquiries
the key to good science in this field is always to keep the experiment totally under the control of the investigators and to use blind and double-blind testing procedures wherever possible .	investigators	researches	experiments	inquiries
leading International private detective and private investigator firm for all private investigations , we stand ready with any private detective or private investigator matter .	investigator	detective	inspector	researcher	inquirer
in addition , it is important for clinicians and investigators to account for any herbs or natural products being taken by their patients or research subjects that might interact with traditional treatments .	investigators	researches	experiments	inquiries
American investigators had to be sent anywhere but Holland .	investigators	detectives	offices	researches	inquiries
they suggest that investigators of new religious movements should look into adaptation in host communities as well as NRMs , and that they pay special attention to the role of the mass media in this two-way process of adaptation .	investigators	researches	detectives	examines
the present , rejecting attitude restricts investigators to using simple tools , which are incapable of answering the questions skeptics demand be answered .	investigators	researches	experiments	examines	inquiries
there he was a section leader for inorganic chemistry and principal investigator on several research projects dealing with actinide coordination and organometallic chemistry , organometallic chemical vapor deposition , and technetium-99 chemistry .	investigator	researcher	inquirer
`` something will hopefully be done `` , to ensure that even if the mission were to close tomorrow , FM103 `` continues in some form or sort , to consolidate the peace process .	mission	assignment	office	charity	negotiation	legation	delegation
