famous for hosting the annual Rose bowl football game and the tournament of Roses parade , Pasadena is the home of many leading scientific and cultural institutions , including the California Institute of Technology , Pasadena City College , the Jet propulsion Laboratory , Art Center College of Design , the Pasadena Playhouse , California School of culinary Arts Pasadena , the Norton Simon Museum of Art and the Pacific Asia Museum .	leading	top	important	popular	famous	great	notable	head	major	good	big	foremost	main	heading	advanced
bunch is a small unincorporated community in southwestern Adair County , Oklahoma , United States .	community	town	group	neighborhood	city	area	settlement	village	society	district	locality
the association of virtue with withdrawal from society - and specifically from cities - was a familiar theme in religious literature .	theme	idea	topic	subject	motif	storyline	plot	concept	happening	point	pattern	thought	place	design
she has three older brothers : Aaron , Benjamin , and Nathaniel , the latter of whom is a model and actor .	latter	last	other	final	youngest	later	last-mentioned	previous
before meeting the Sacramento River , the San Joaquin River has two distributary rivers , the Old River and the Middle River , both of which once were the main channels of the river . due to the bend in the San Joaquin River channel at the head of the Old River , a significant portion of the San Joaquin River flow continues down the Old River instead of heading northward along the San Joaquin .	significant	large	big	important	major	heavy	huge	larger	considerable
the primary trinity included Tinia , uni and Menrva .	primary	main	first	central	original	leading	initial	complete
Tolstoy was born in Yasnaya Polyana , the family estate in the Tula region of Russia .	estate	home	property	house	residence	lands	land	domain	grounds
the Earthquake Engineering Research Institute is a leader in dissemination of earthquake engineering research related information both in the U.S. and globally .	research	study	studies	information	investigation	studying	collecting	findings	science	work	analysis	learning	data
notable former managers of Notts County include Jimmy Sirrel , Neil Warnock , Howard Kendall and Sam Allardyce .	former	past	previous	old	prior	earlier	last	retired	ex
in addition to local research conducted at the radio telescope , Parkes scientists have assisted NASA for several missions as a Southern Hemisphere relay and communications station .	assisted	helped	aided	supported
Volcanologists frequently visit volcanoes , especially active ones , to observe volcanic eruptions , collect eruptive products including tephra , rock and lava samples .	frequently	often	usually	regularly	always	constantly	commonly
pool , also known as pocket billiards , is the general term for a family of cue sports played on a pool table with six receptacles called pockets along the , into which balls are deposited as the main goal of play .	receptacles	holes	containers	holders	openings	divisions	pouches	baskets	places	areas
he normally appears in a running gag , where he usually suffers unfortunate , nearly always fatal , events .	unfortunate	bad	unlucky	sad	terrible	unhappy	hapless	tragic	unlikely	damaging	disasterous
most digital media are based on translating analog data into digital data and vice-versa .	translating	changing	converting	turning	rewording	explaining	transferring	decoding	running	moving	making	understanding
Wrestlers portrayed a villain or a hero as they followed a series of events that built tension , and culminated into a wrestling match or series of matches .	villain	criminal	enemy	bad-guy	evildoer	outlaw	antagonist	offender
not to be confused with `` terms '' in colloquial usages , the shortened form of technical terms which are defined within a discipline or speciality field .	discipline	subject	practice	area	control	career	job	study	specific	category	thought	group	field	mastery	specialist	profession	trade	topic	skipping	course	skill	education	order	strict	method
a `` dune field '' is an area covered by extensive sand dunes .	extensive	many	large	huge	wide	major	big	complex	numerous	vast
107 Camilla is one of the largest main belt asteroids .	largest	biggest	top
first mentioned by the Ancient Greek geographer Ptolemy , the pre-Christian settlement of the Saxon people originally covered an area a little more to the northwest , with parts of the southern Jutland Peninsula , Old Saxony and small sections of the eastern Low Countries .	sections	parts	areas	portions	portion	places	pieces
Jeanne Demessieux had a prodigious memory : she had memorized more than 2,500 works , including the complete organ works of Johann Sebastian Bach , Csar Franck , Franz Liszt , Felix Mendelssohn and Marcel Dupr .	prodigious	great	huge	big	fantastic	vast	remarkable	large	amazing	impressive	excellent	colossal	stunning	good
at the end of each season , a series of playoff games are contested among the top six teams in the NFC , consisting of the four division champions and the two other teams with the best win-loss records .	contested	played	fought	debated	argued	running	disputed	matched
veritas and Undina would have been the largest fragments of that collision .	fragments	pieces	parts	peices	rubble	piece	remnants
after the partitions of Poland in 1794 the area was annexed by Prussia .	annexed	added	taken	claimed	united	seized	acquired	captured	separated	cutoff	given	overtaken	seperated	adjoined	conquered
the models initially had difficulty predicting the track of the depression and the forecasts from the National Hurricane Center reflected this , indicating that the depression would move towards Texas .	reflected	showed	mirrored	repeated	displayed	noted	echoed	demonstrated
a British nobleman , Lord Stanhope , took an interest in Hauser and gained custody of him late in 1831 .	gained	got	took	won	obtained	received	had	earned	acquired	aquired	granted	increased	gave
Simon Phillip Cowell is an English music executive , television producer and entrepreneur .	entrepreneur	businessman	businessperson	tycoon	founder	buisnessman	executive	business-owner	promoter	employer	manager	businessmen	businesman	salesman	maker
the remnants of the depression persisted until 2 am EDT at which time it was absorbed by a warm front .	absorbed	consumed	removed	lost	overtaken	immersed	ended	taken	swallowed	erased	enveloped	made	eaten	incorporated	conjoined	destroyed	stopped	overrun	taken-over	replaced	evaporated	racing	overcome
a good measure of notability is whether someone has been featured in multiple , independent , reliable sources .	multiple	many	several	different	numerous	trotting	some
it originally aired on the Fox network in the United States on October 10 , 1991 .	aired	showed	played	shown	appeared	ran	televised	broadcasted	premiered	opened
religious law is explicitly based on religious precepts .	precepts	rules	ideas	beliefs	laws	principles	commandment	tenets	belief	teachings	guidelines	actions	standards	thought	code	examples	doctrine	concepts	directions	order	orders	thoughts
the principal greenhouse , in an art nouveau style with a modern metallic structure , resembles the mid-19th century Crystal Palace in London .	resembles	matches	simulates	represents	looks-like	mirrors	favors	mimics	echos	match	shows
Metlink , formerly The Met , is the marketing body and umbrella brand for public train , tram and bus transport operators in Greater Melbourne , Victoria , Australia .	brand	company	name	type	symbol	label	logo	body	status	product	branch	sign	trademark	character	term	maker	mark	tradename	entity	kind	manufacturer
on April 9 , 1919 , Miss Marcella Sherwood , who supervised the Mission Day School for Girls was bicycling round the city to close her schools when she was assaulted by a mob in a narrow street , the Kucha Kurrichhan , was beaten and left wounded .	assaulted	attacked	hurt	beaten	beat	fought	battered
Schoenberg refused , saying `` I would only make you a bad Schoenberg , and you 're such a good Gershwin already . ''	refused	declined	denied	rejected	didn't	denies	disagreed	wouldn't	replied	reject	negated
however media outlets soon found ways around the ban , initially by the use of subtitles , but later and more commonly by the use of an actor reading his words over the images of him speaking .	initially	first	originally	firstly	usually	always	starting
however , the new king , Louis XVIII , knew that ideas of nationalism and democracy still lingered in his country ; hence the establishment and signing of the Charte constitutionnelle franaise , the French Constitution otherwise known as La Charte .	hence	so	thus	therefore	causing	forward	then	since	explaining
in 1873 mine employers attempted to introduce Saturday afternoon and Sunday shifts .	attempted	tried	sought	tryed
he then settled in the Avon Valley , one of the most rugged and inaccessible places in the Darling Range .	inaccessible	unreachable	remote	difficult	out-of-the-way	unapproachable	distant	unavailable	limited	dangerous	decrepit	isolated	hard-to-reach	off-limits	roadless	unattainable	hidden	impassable
the central planets are firmly under Alliance control , but the outlying planets and moons resemble the 19th century American West , with little governmental authority .	outlying	outer	distant	far	surrounding	remote	furthest	farthest	backwoods	other	farther	further
in 1639 , Williams established a Baptist church in Providence , Rhode Island , and Clarke began a Baptist church in Newport , Rhode Island .	established	started	created	made	founded	began	built	completed	owns
while each edition of Windows 2000 was targeted to a different market , they share a core set of features , including many system utilities such as the Microsoft Management console and standard system administration applications .	core	basic	main	base	common	central	center	same	standard	important	fundamental	similair	similar	kernal
the first conflict between the British and the Marathas was the First Anglo-Maratha War which began in 1774 and resulted in the 1782 treaty of Salbai , by which the island of Salsette , adjacent to Bombay island , was ceded to the British , while Bharuch was ceded to the Maratha ruler Scindia .	adjacent	next	close	near	connected	across	bordering
OpenOffice.org Calc is the spreadsheet component of the OpenOffice.org software package .	component	part	piece	element	tool	software	segment	equal	section
the Countess tells him it is only Susanna , trying on her wedding dress .	tells	informs	told	advises	explains	says	advices	warns	bids
early representations of the balalaika show it with anywhere from two to six strings , which resembles certain Central Asian instruments .	representations	models	images	pictures	examples	drawings	depictions	types	leaders	versions	showing	remakes	ideas	reports	records	descriptions	signs	likenesses	showings	views	thoughts	displays
additional praise was given to its scope and future potential based on user-created content ; minor criticism was reserved for specific elements of the gameplay mechanics and level creation facilities .	elements	parts	types	aspects	details	items	portions	features
Loamhedge is a fantasy novel by Brian Jacques , published in 2003 .	published	released	printed	written	issued	made	sold	created
the Eastern Orthodox Church accepts psalm 151 as canonical . Roman Catholics , Protestants , and most Jews consider it apocryphal .	consider	think	believe	find	call	deem	assume	feel	figure	view
he aided the Doukhobors in migrating to Canada .	aided	helped
it is a permissive license , meaning that it permits reuse within proprietary software on the condition that the license is distributed with that software . the license is also GPL-compatible , meaning that the GPL permits combination and redistribution with software that uses the MIT license .	permits	allows	admits	lets	grants
the battalion is usually part of a regiment , group or a brigade , depending on the organizational model used by that service .	usually	normally	often	mostly	generally	typically	commonly	sometimes	current
intense feelings of resentment trigger the initial retaliation , which causes the other party to feel equally aggrieved and vengeful .	retaliation	revenge	attack	payback	reaction	response	vengeance	return	counterattack	fight	revengeance	retribution	reprisal	vengance	repayment	anger	vengence	punishment
gravitational energy is the energy associated with the gravitational field .	associated	linked	connected	related	partnered	found	used	placed	involving	mixed	affiliated	allocated	similar
the dead body of a human is referred to as a cadaver , or corpse .	human	person	man
marshal Manuel Deodoro da Fonseca became the first president of the Republic of Brazil after heading a military coup that deposed Emperor Pedro II .	coup	takeover	overthrow	action	plot	revolution	rebellion	uprising	revolt	upset	take-over	group	win	camp	mission	fight	attack	overturning	team	operation	conflict
Slipknot is a heavy metal band formed by vocalist and percussionist Anders Colsefni , guitarists Donnie Steele and Josh `` Gnar '' Brainard , bassist Paul Gray , drummer Joey Jordison and percussionist Shawn Crahan , in Des Moines , Iowa .	formed	made	created	started	begun	shaped
the most recent goaltender to have scored a goal by deliberately shooting the puck into his opponents ' net was Evgeni Nabokov , in 2002 .	deliberately	purposely	purposefully	intentionally	knowingly	freely	purposly	willfully	instinctively	carefully	directly
following the withdrawal of the more powerful Class 74 electro-diesels in 1977 , the Class 73 is now unique on the British railway network .	network	system	grid	lines	connection	tracks	group	chain	combination	systemm	collection	connections	line	networks
upon receiving its classification , the depression consisted of a partially exposed low-level center with deep convection occupying the northeastern semicircle .	occupying	in	covering	inside	filling	inhabiting	on	holding	settling	living	staying	forming	taking	engulfing	over	owning
these notable synagogues include ; the Great Synagogue of Rome , the New Synagogue , the Leopoldst_dter Tempel , the Grand Choral Synagogue , the Great Synagogue , the Moscow Choral Synagogue , the Great Synagogue of Florence , the Great Synagogue , Plzen , the Great Synagogue , the Ko ice Orthodox Synagogue , the Novi Sad Synagogue , the Szeged Synagogue , the Sofia Synagogue and the Great Synagogue of Oran .	notable	important	famous	popular	great	major	prominet	noticeable	evident	famed	other	best	known	main	special
most of the detainees were captured Japanese and Italian military personnel , On August 5 , 1944 at least 545 Japanese POWs attempted a mass breakout from the camp , in perhaps the largest prison escape in world history .	breakout	escape	leave	outbreak	exit	runaway	fight
Vinaigrette is a mixture of salad oil and vinegar , often flavored with herbs , spices , salt , pepper , sugar , and other ingredients .	ingredients	parts	items	things	pieces	foods	stuff	elements	spices	substances	flavors	herbs	toppings	contents	fixings
he supported the building of churches by distributing literature and providing ministers .	distributing	giving	sharing	sending	spreading	disbursing	alloting	releasing	organizing
as of the early 21st century , Christianity has between 1.5 billion and 2.2 billion adherents .	adherents	followers	believers	members	fans	supporters
many schools teach children to make sock puppets and then have the children put on shows or plays for the whole school with them , sometimes with all the sock puppets singing .	singing	talking	chanting	performing	crooning	caroling	humming	vocalizing	harmonizing	used	yelling	voicing	hum	harmonising	songs
the word cereal derives from Ceres , the name of the Roman goddess of harvest and agriculture .	derives	comes	came	originates
Miramax Films was last operated by Daniel Battsek who reported to Rich Ross , chairman of Walt Disney studios Motion Pictures .	operated	run	ran	managed	worked	used	controlled	directed	employed	handled	performed
he is portrayed by Mark Hamill .	portrayed	played	represented	acted	shown	imitated	depicted	done
super smash Bros. was developed by HAL Laboratory , a Nintendo second-party developer , during .	developed	made	created	started	written	established	built
the northern and western edges of the Cotswolds are marked by steep escarpments down to the Severn valley and the Warwickshire Avon .	escarpments	cliffs	slopes	hills	slope	ledges	bluffs	ridges	rocks	declines	steps	inclines	embankments
they renamed the place Alcante or Alcanatif which means Port of Salt , due to the old salt industry of Phoenicians and Romans .	renamed	called	named	changed	dubbed	reassigned	reintroduced	recalled	retitled
it was founded in 1964 in Hamilton , Ontario by Canadian hockey player Tim Horton and Jim Charade , after an initial venture in hamburger restaurants .	founded	started	created	formed	made	begun	started'	set	opened	explored
the annual mean temperature is 25 C ; regional mean temperatures range from 18 C in the heart of the Cordillera Central to as high as 27 C in arid regions .	annual	yearly	year's	usual
Epistemology or theory of knowledge is the branch of philosophy concerned with the nature and scope of knowledge .	scope	range	area	extent	amount	view	width	depth	span	breadth	capacity	level	variety	field	purpose	types
the process is termed lichenometry .	termed	called	named	coined
the name `` Sea of Corts '' is the one preferred by most local residents .	residents	people	citizens	population	folks	locals	villagers	habitants	members
the 1997 Atlantic hurricane season officially began on June 1 , 1997 , and lasted until November 30 , 1997 .	lasted	continued	went	stayed	didn't end	ended	remained	didn't stop	wenty	wasn't over
this was the first time in survivor history that the two initial teams were not preselected by the producers .	preselected	chosen	picked	selected	assigned	predetermined	made	determined	screened
the geological community generally accepts this hypothesis because it best explains sedimentary deposits generally regarded as of glacial origin at tropical paleolatitudes and other enigmatic features in the geological record .	hypothesis	theory	idea	guess	reasoning	belief	proposition	prediction	theorem
the hells angels , at the peak of their ` outlaw ' reputation , corralled lost children .	corralled	gathered	collected	found	caught	captured	cornered	caged	took	bothered	sought	contained	enclose	enclosed	detained	confined	stole
the roof of the West Stand is corrugated iron this also houses the main television gantry which is accessed from the upper tier seating area by a temporary ladder .	tier	level	section	row	area	layer	floor	deck	series	sectioned	part
it gradually decayed into a surface low pressure trough , and developed into two disturbances ; one was centered 290 miles south-southeast of Cape Cod and another was located 200 miles south of Cape Hatteras , North Carolina .	gradually	slowly	increasingly	eventually	regularly	slightly	gently	steadily
techno is a form of electronic dance music that emerged in Detroit , Michigan , US during the mid to late 1980s .	emerged	started	appeared	began	originated	rose
Dhamtour has an average elevation of 1110 metres .	elevation	height	altitude	rise
while in Cambrai he collaborated with Nicolas Grenon on a complete revision of the liturgical musical collection of the cathedral , which included writing an extensive collection of polyphonic music for services .	included	involved	contained	meant	covered	has	was	used	had	took	comprised	are	have	contain
it is also the only one of the former provinces of South Africa not to undergo border changes , excluding the incorporation of Bantustans .	excluding	except	besides	without	barring	minus	prohibiting	bans	removing	excepting	rejecting	ignoring	saving
nevertheless , until the middle of the 20th century , agriculture dominated the canton .	nevertheless	still	however	regardless	yet	anyway	but	sill	also	anyhow	so	nonetheless
the chain accounted for 22.6 % of all fast food industry revenues in Canada in 2005 .	accounted	reported	made	appraised	counted	helped	stood	considered	credited	responsible	recorded	lasted	comprised	produced	represented	madeup	included	counts	estimated
whatever the truth of the rumors , James required a royal match to preserve the Stuart line .	preserve	keep	save	maintain	protect	continue	remain	hold
in 2005 and 2006 , the Bulgarian State Railways begin operating Desiro trains as part of a 67-million deal with Siemens AG for a total of 25 Diesel multiple units .	operating	running	using	working	driving	managing	making	conducting	controlling
this category contains articles about albums released on Island Records .	contains	has	holds	includes	houses	features
their heaviest defeats in the league were 10 - 1 against Fulham in 1963 and 9 - 0 against Manchester United in 1995 .	heaviest	biggest	worst	largest	hardest	most	strongest
uniquely among mammals , these teeth are continuously replaced throughout life , with new teeth growing at the rear as older teeth fall out from farther forward in the mouth .	continuously	always	constantly	repeatedly	regularly	frequently	forever	continually
it is also known as a clothes iron , flat iron , or smoothing iron .	smoothing	flattening	press	leveling	evening	pressing	even	straightening	an	anti-wrinkle	clear	surface	levelling	regular	sleek	rubbing
some of the first inhabitants of Gili Trawangan were from Sulawesi who are fishermen and farmers .	inhabitants	people	residents	settlers	natives	citizens	dwellers	occupants	peoples
thousands of videos exist on YouTube of users showing the original video to their friends and taping their reactions , although some videos seem to be staged .	taping	recording	filming	showing	capturing	recorded	videoing
however , on 13 April 2008 , before the completion of the initial five years , it was announced that Bryce was to become the next Governor-General of Australia .	initial	first	beginning	original
Kasem is best known by name as a music historian and disc jockey , most notably as host of the weekly American Top 40 radio program from 1970 to 1988 , and again from March 1998 until January 10 , 2004 , when Ryan Seacrest succeeded him .	program	show	schedule	broadcast	station	agenda	segment	event
Liriodendron tulipifera , commonly known as the American tulip tree , tulip poplar or yellow poplar , is the Western Hemisphere representative of the two-species Liriodendron genus and the tallest eastern hardwood .	commonly	usually	also	often	mostly	normally	generally	widely	regularly	is	mainly	most	simply	frequently	typically	otherwise
another allegation asserts that during the previous year , on Saint Bartholomew 's Day , Vlad had 30,000 of the merchants and officials of the Transylvanian city of Bra ov impaled for breaking his authority .	asserts	says	claims	states	insists	is	implies	declares	pushes	affirms
the result is a region of braided streams , marshes , and lakes the size of Belgium ; the seasonal floods make the Delta extremely productive for both fishing and agriculture .	extremely	very	highly	immensely	greatly
during one event , German Charley attempting to prevent the theft of a racehorse from the Coombing Park stables was shot to death by Mickey Bourke .	prevent	stop	avoid
the cheetah hunts by vision rather than by scent .	vision	sight	eyesight	seeing	eye
spun yarns may contain a single type of fiber , or be a blend of various types . combining synthetic fibers with natural fibers is very common .	various	different	many	several	other	myriad
the character may be speaking his or her thoughts aloud , directly addressing another character , or speaking to the audience , especially the former .	character	person	actor	figure	guy	personality	role	artist
the Aar , a tributary of the Rhine , is the longest river that both rises and ends entirely within Switzerland .	rises	begins	starts	climbs	soars	ascends	grows	swells	climb	ups
the atmosphere was so intense that Gring , in a telephone call that evening , stated : `` There is unbelievable jubilation in Austria .	stated	said	daid	sayed
the intent is to display the likeness , personality , and even the mood of the person .	intent	purpose	idea	goal	point	meaning	reason	plan	desire	aim	trotting	attempt
Kavirondo is the former name of the region surrounding Kavirondo Gulf as well as of two native peoples living there under the regime of British East Africa .	former	old	previous	earlier	last	prior	before	first	other	older
they are a type of reporter gene used in laboratory microbiology , molecular biology , and genetic engineering to indicate the success of a transfection or other procedure meant to introduce foreign DNA into a cell .	indicate	show	imply	check	explain	mark	identify	determine	measure	tell	shows
several other Hollywood films are also believed to have been inspired by Bollywood films .	inspired	influenced	encouraged	started	motivated	stirred	aroused	made	affected	triggered	created	originated	caused	guided	infuenced	helped	fueled	begun	moved
Winchester College was founded in 1382 by William of Wykeham , Bishop of Winchester and Chancellor to both Edward III and Richard II , and the first seventy poor scholars entered the school in 1394 .	scholars	students	teachers	intellectuals	academics	specialists	student	educators
they consider the period of 1917 to 1991 to have been a period of occupation by the Soviet regime which was internationalist and anti-Christian .	regime	government	rule	group	leadership	administration	box	leaders	power	army	system	rulers	command
Microsoft Windows includes an implementation of SSL and TLS as part of its Secure Channel package .	implementation	use	addition	application	version	usage	inclusion	start	example	configuration	installation	combination	utilization	introduction	approach	copy	instance	type	program	aspect	realization	execution	employment	similar
