the CIBF was founded by the General Egyptian Book Organisation , a government publishers and retailers group , in 1969 to coincide with celebrations of the 1000th anniversary of the founding of the city of Cairo .	founding	start	creation	beginning	starting	making	discovery	establishment	birth	establishing	origin	begining	creating	established	opening	settlement	original
it initially was completely dark , but as Voyager 2 approached the planet , a bright core developed and can be seen in most of the highest-resolution images .	initially	first	originally	firstly
a perfectly elastic collision is defined as one in which there is no loss of kinetic energy in the collision . an inelastic collision is one in which part of the kinetic energy is changed to some other form of energy in the collision .	kinetic	moving	active	movement	motion	real	living	innate	driving	motion-	powerful	motive	stored	static	strong
problems may arise particularly with disposable soft lenses ; if the surface tension between the lens and the finger is too great the lens may turn itself inside out ; alternatively it may fold itself in half . when the lens first contacts the eye , a brief period of irritation may ensue as the eye acclimatizes to the lens and also as dirt on the lens irritates the eye .	irritation	discomfort	pain	annoyance	soreness	tenderness	aggravation	stress	burning	rawness	itching	sensitivity	hurt	sore	uncomfortableness	bothering	tearing	itchiness
Mary Toft , also spelled Tofts , was an English woman from Godalming , Surrey , who in 1726 became the subject of considerable controversy when she tricked doctors into believing that she had given birth to rabbits .	controversy	debate	argument	scandal	talk	confusion	problems	dispute	fuss	disagreeing	discussion	attention	disagreement	tricked	fight	questioning	outrage	gossip	strife	conflict
SDLP leader John Hume , MP , identified the possibility that a negotiated settlement might be possible and began secret talks with Adams in 1988 .	identified	found	recognized	saw	showed	spotted	said	noticed	noted	stated	suggested	realized	selected	described	hinted	considered	knew	discovered	reconized	revealed
a brief stint on Go Kart Records saw the release of `` Fly the Flag '' , and now with their latest release of `` Windward tides and wayward sails '' in 2003 finds them on Union Label Group .	latest	newest	new	recent	last
it is currently used mostly for football matches and is the home stadium of Union sportive du foyer de la Rgie Abidjan-Niger .	matches	games
for the next several weeks , Kozlov was interviewed on WWE programming , proclaiming his love for `` Double Double E '' but also began drawing a villainous response after declaring his superiority over whatever wrestlers were competing at the time , saying `` I could beat both of them . ''	villainous	evil	bad	mean	crooked	criminal	negative	hateful	wicked	hated	vicious	evilish	unpleasant	bad-guy	nasty	relating
according to Kojiki , the entrance to Yomi lies in Izumo province and was sealed off by Izanagi-no-Mikoto upon his flight from Yomi , at which time he permanently blocked the entrance by placing a massive boulder at the base of the slope that leads to Yomi . upon his return to Ashihara-no-Nakatsukuni , Izanagi noted that Yomi is a `` polluted land '' .	placing	putting	setting	adding	moving	laying	leaving
the rice plants in the strain can be bred to other rice strains or cultivars , and if desirable plants are produced , these are further bred to stabilize the desirable traits ; the stabilized plants that can be propagated and `` come true '' are given a cultivar name and released into production to be used by farmers .	bred	raised	mated	made	mixed	added	connected	produced	paired	created	crossed	cultivated	grown	planted	given	married	reproduced	developed	changed	attached	born	spread	shared	refined	spawned
due to their fast growth , the foremost benefit of these trees is their wood .	foremost	biggest	main	greatest	first	best	primary	leading	major	highest	important	largest
its status as an official geological period was ratified in 2004 by the International Union of Geological Sciences , making it the first new geological period declared in 120 years .	ratified	approved	confirmed	passed	accepted	changed	signed	created	established	declared	stopped	endorsed	certified	enacted
more specifically , the term stratus is used to describe flat , hazy , featureless clouds of low altitude varying in color from dark gray to nearly white . a `` cloudy day '' usually features a sky filled with stratus clouds obscuring the disk of the sun .	featureless	plain	bland	blank	boring	shapeless	ordinary	dull	edgeless	flat	uniform	nondescript	uninteresting	round	empty
Nuremberg was then an important and prosperous city , a center for publishing and many luxury trades .	prosperous	rich	wealthy	successful	thriving	flourishing	big	productive	succesful	peaceful
super Mario 64 is also characterized by featuring more puzzles than earlier Mario games .	puzzles	games	challenges	riddles	mazes	brainteasers	mystery	activities	inside mini-games	tasks	traps	teasers	trials	mysteries
their escapades earned them a cover shot and a nude pictorial in a Playboy spread .	pictorial	picture	photo	visual	graphic	spread	album	shoot	photograph	pictures	article	photospread	display
in 1971 , she witnessed the impoverished conditions of the trash collectors in Cairo , Egypt , and decided to live among them .	witnessed	saw	observed	seen	noticed
nearby there is the Goobang National Park , and Peak Hill which features an Open Cut Mine that can be toured during holidays .	features	has	shows	includes	displays	boasts	offers	hallmarks	spotlights
good Friday , also called Holy Friday , Black Friday , or Great Friday , is a holiday observed primarily by adherents to Christianity commemorating the crucifixion of Jesus and his death at Calvary .	primarily	mostly	mainly	normally	exclusively	predominantly
as of , it lies at latitude 66 33 39 south of the equator .	lies	is	sits	exists	rests	locates	sets	stands	resides	stations
along with Herculaneum , its sister city , Pompeii was destroyed , and completely buried , during a long catastrophic eruption of the volcano Mount Vesuvius spanning two days in 79 AD .	eruption	explosion	blast	burst	blasting	ejection	spuing	blow-up	explosion'	outburst
human interference has nearly exterminated them in many areas , and , except for the beech forests of the Austrian Alps , forests of deciduous trees are rarely found .	rarely	seldom	hardly	uncommonly	barely	sometimes
Nakm won , and Yaxh was instructed to find a new campsite .	instructed	told	taught	ordered
the sheer weight of the continental icecap sitting on top of Lake Vostok is believed to contribute to the high oxygen concentration .	contribute	add	give	cause	lend	provide	assist	share	created
the album peaked at number 10 on the U.S. billboard 200 chart , selling 48,397 copies in its first week of release ; it was eventually certified gold by the RIAA in 2008 .	certified	made	confirmed	declared	approved	awarded	guaranteed	given	verified	named	rated	proved	stamped	confirm	acknowledged	cited	turned	deemed	proven	labeled	catagorized	authorized	sworn	granted
the adjacent town of Gzhatsk was renamed Gagarin in 1968 in his honor .	adjacent	nearby	next	close	neighboring	near-by	closeby	joined	bordering
at backlash , Benoit retained the World title , after he forced Michaels to submit to the Sharpshooter .	forced	made	compelled	caused	pushed	affected	powered	required	got	drove	told
during the First Boer War , the city was besieged by Republican forces in December 1880 and March 1881 .	besieged	attacked	surrounded	taken	invaded	overrun	trapped	controlled	overwhelmed	encircled
one of the defining aspects of the Nintendo GameCube is the rejuvenated relationship between Nintendo and its licensees . unlike previous generations in which Nintendo was seen by some as bullying its third-party game developers , Nintendo openly sought game-development aid on the Nintendo GameCube .	rejuvenated	renewed	new	restored	mended	revived	improved	fresh	energized	strengthened	restarted	redesigned	renew	healed	reborn	revitalized	newer	friendly
none of your watched items were edited in the time period displayed .	edited	changed	revised	shortened	finished	scanned	refined	fixed	revise
originally made for the Apple II , they were later ported to other platforms .	ported	moved	sent	transferred	brought	taken	adapted	copied	made	carried	available	harbored	given	added	docked	changed	turned	adopted	remade	transfered
his work is displayed in the Museum of Modern Art in Yerevan .	displayed	shown	showed	visible	showing	revealed	exhibited
he was a prolific discoverer of asteroids , discovering 122 in all , from 136 Austria in 1874 to 1073 Gellivara in 1923 .	discovering	finding	found	observing
males usually weigh about 500 lbs , but very large & old specimens can reach up to 2000 lbs .	specimens	ones	types	creatures	kinds	individuals	animals	examples	samples	males	species	fossils	specie	versions	models	men	subjects	gorillas	cases
it was used to signify those who appreciated Austen in the `` wrong '' way and the term , according to Lynch , is `` now used almost exclusively about and against other people '' .	signify	show	mean	indicate	identify	represent	describe	imply	mark	label	point
a committee of the institute appoints the laureates for the Nobel Prize in Physiology or Medicine .	laureates	winners	honorees	nominees	candidates	honors	honored	contestants	poets	scholar	ornament	site	prizewinners	notables	medalists	recipient	honor	recievers
Montgomery County of the U.S. state of Maryland is situated just north of Washington , D.C. and southwest of Baltimore .	situated	located	found	placed	set	sitting
this spelling was later corrupted to Ouisconsin by other French explorers , and over time this version became the French name for both the Wisconsin River and the surrounding lands .	version	form	type	kind	spelling	one	story	edition	name	impression	term	word	style	update	part	way	alternative
several people required rescue assistance , and in Comal County a car accident caused three fatalities .	caused	created	made	produced	had	brought	instigated	causing	incurred
Schigolch removes the body while Geschwitz contemplates suicide , an idea she gives up when she realizes that Lulu will not be moved by it .	removes	takes	hides	moves	took	discards	replaces	withdrew	eliminates	clears	transfers	rids	extracts
Anti-tank dogs were dogs taught to carry explosives to tanks , armored vehicles and other military targets .	targets	marks	objects	goals	enemies	objectives	points	aims	vehicles	places	spots	destinations	hits	kills	bullseyes	weapons	equipment	objective	bull's-eyes
a historic organ was installed in it by the Austrian firm Rieger , in 1907 .	installed	put	built	placed	setup	connected	integrated
the birthday cake is traditionally highly decorated , and typically covered with lit candles when presented , the number of candles signifying the age of the celebrant .	traditionally	usually	normally	always	commonly	often	historically
he secured a top post at the Vienna State Opera in 1943 , eventually becoming music director .	secured	got	earned	achieved	gained	saved	had	took	scored	obtained	locked	received	recieved	won	attained	reached	fastened
the family - mother , father , old woman , young man , baby , and dog - are attempting to eat pieces of metal , such as chains , bicycle handlebars , and rifles .	attempting	trying
in Wales , four Church of England dioceses were disestablished in 1920 , becoming separated from the Church of England in the process and subsequently becoming the Church in Wales .	separated	divided	removed	different	apart	split	moved	disconnected	independent	seperate	divorced	distinct	free	detatched	disjointed	distant	detached	independant	severed
in the 19th century and the first part of the 20th , baseball shoes were commonly black in color .	commonly	usually	often	normally	mostly	generally	regularly	typically	mainly	frequently
Hydrostatic equilibrium occurs when compression due to gravity is balanced by a pressure gradient which creates a pressure gradient force in the opposite direction .	compression	squeezing	pressure	shrinking	compaction	squishing	stress	tightness	power	pushing	shortening	flattening	forces	tightening	adjustment	flattened	force
the True Cross is the name for physical remnants which , by a Christian tradition , are believed to be from the cross upon which Jesus was crucified .	remnants	remains	pieces	leftovers	parts	bits	remainders	peices	artifacts	items	residual	part
seafloor spreading occurs at mid-ocean ridges , where new oceanic crust is formed through volcanic activity and then gradually moves away from the ridge .	gradually	slowly	increasingly	eventually	regularly	progressively
in 1887 the school relocated to the East Lake community of Birmingham .	relocated	moved	transferred
some Han Chinese believe they share common ancestors , mythically ascribed to the patriarchs Yellow Emperor and Yan Emperor , some thousands of years ago .	mythically	magically	falsely	supposedly	historically	legendary	fictitiously	fictionally	traditionally	divinely	anciently	artifically	from	legendarily	religiously	pretended	truly	sometimes	possibly	unreal	creatively	mystically	normally
Simms works alongside co-host and designer Daniel Kucan to redecorate a room of a home in just two days and with only $ 2,500 .	redecorate	redo	redesign	remodel	change	rearrange	decorate	remake	makeover	renovate	update	furnish
Pikachu is among the most recognizable Pokmon , largely because a Pikachu is a central character in the Pokmon anime series . Pikachu is widely considered the most popular Pokmon , is regarded as the official mascot of the Pokmon franchise , and has become an icon of Japanese culture in recent years .	considered	thought	believed	admired	deemed	called	chosen	regarded	reviewed	known	crowned	agreed	viewed
Harvey became a strong extratropical storm during the night on August 8 and survived another few days before dissipating northwest of the Azores on August 14 .	survived	lasted	lived	remained	raged	existed	continued
in response to the weather system , the American National weather Service issued wind watches for the Oregon Coast .	response	reply	answer	reaction	regards	looking	answering	return	expectation	acknowledgement
it reached a peak position of number thirty-seven on the billboard Hot Modern Rock tracks chart .	reached	hit	gained	topped	made	received	extended	held	achieved	acheived	met	touched	attained	got	entered	was
Pskov is an ancient city located in the north-west of Russia about east from the Estonian border , on the Velikaya River .	located	found	situated	placed	based	set	laying	is	positioned	that has it's place	lying	nearby
the major scale may predominate the minor scale in Western music because of its unique harmonic properties ; in particular the major third is much stronger in the harmonic series than the minor third .	particular	specific	especially	specifically	fact	detail	general	reguard	actual	that	distinct	certain	relation	nature	mainly	including	essence	usually	import	example	special
so impressed was Rostropovich with his young pupil that at the end of her study with him , he declared her `` the only cellist of the younger generation that could equal and overtake own achievement . ''	declared	called	announced	named	proclaimed	told	said	deemed	made	anounced	confirmed	recognized	elected	labeled	claimed	appointed
the marriage was marked from the outset by sexual passion and emotional insensitivity when Tolstoy , on the eve of their marriage , gave her his diaries detailing his extensive sexual past and the fact that one of the serfs on his estate had borne him a son .	outset	beginning	start	begining	origin	beggining
born as Alfons Karg , he was trained as a telecommunications technician , but soon became disenchanted with this profession .	profession	job	career	work	specialty	occupation
some features , however , are reminiscent of the Scout movement .	reminiscent	similar	remindful	reminders	memorable	familiar	suggestive	like	comparitive	made	telltale	replicas	piec	nostalgic	echoes	evocative
the Shinto pantheon alone consists of an uncountable number of kami .	consists	is	contains	comprises	composed	made	exists	belong	had	endures	includes	have	has
this message earned Saddam a great deal of popularity in many sectors of the Arab world .	sectors	parts	areas	regions	sections	places
suddenly there was a scattering of fire , which three outfielders caught the brunt ; the centerfield was hit and was captured , left and right field managed to get back to our lines .	managed	succeeded	endeavoured
`` C158 ( cf ex R145 ) `` The Provincial in Councilor the Superior ofthe Delegation in Councilsets the financial competency of local Superiorsand their Councilsand determines which assets can be managed by individualOblates and by local superiors and their Councils .	managed	controlled	handled	directed	overseen	organised
business development manager strategic alliances This individual will be responsible for coordinating , negotiating , launching , and managing Accuity 's partner relationships .	managing	handling	controlling	directing	organising
a married woman retains ownership of any property she brought to the marriage , but the husband has the right to manage the property and to enjoy profits from the property .	manage	control	organise	govern
we do not need to ask for your specific permission to do these things , as explained below : treatment Partners health care providers will use and share your health information to provide and manage your health care and related services .	manage	control	direct	coordinate	organise	conduct
according to a White House press release , al-Taqwa and its affiliates `` raise , manage , invest , and distribute funds for al-Qaeda ; provide terrorist supporters with internet service and secure telephone communications ; and arrange for the shipment of weapons .	manage	control	handle	organise	coordinate
that is , if the average person ( say this is 98 % of people ) amasses 10 things , if I manage to acquire 20 things then perhaps my account is not worth twice as much but maybe 10x or 100x as much as average .	manage	success	undertake
there are different types of managed care systems .	managed	controlled	coordinated	administered
Saddam Hussein did n't manage to defeat the Iranians .	manage	success	contrive
the M107 program is managed by the Project Manager Soldier Weapons with engineering support provided by Picatinny 's Armament Research , Development and Engineering Center .	managed	run	controlled	directed	coordinated	conducted	administered
Rubinstein held the gambit pawn with 4.Bf4 and 7.Qd5 , but his neglect of kingside development was severely punished .	severely	seriously	harshly	gravely
this veteran , the oldest pensioner in Great Britain , entered the army in 1758 , and was severely wounded at the battle of Quebec under General Wolfe , in consequence of which he became an out-pensioner of Chelsea Hospital , and continued so for the period of seventy-five years .	severely	badly	gravely	seriously
perhaps the effect of West Nile Virus is sufficient to extinguish endemic birds already severely stressed by habitat losses .	severely	highly	seriously	extremely	gravely	critically
she looked as severely as she could muster at Draco .	severely	seriously	sternly	gravely	harshly
a day before he was due to return to the United States Patton was severely injured in a road accident .	severely	badly	seriously	critically	gravely
use market tools to address environmental issues , such as eliminating subsidies for industries that severely harm the environment , like coal .	severely	badly	seriously	dramatically	gravely
this picture was severely damaged in the flood of 1913 and has rarely been seen until now .	severely	badly	seriously	gravely	devastatingly
i was very disappointed when the author did not go into detail about how he regained his faith after having it severely undermined by his early studies in theology at university .	severely	badly	seriously	heavily	gravely
we do continue to support research on the differentiation of adult precursor cells into beta cells , but that 's a severely limited field in terms of how successful it has been .	severely	extremely	gravely	dramatically
mutual Funds are so severely conflicted that they will not avail themselves of the alleged benefits of the proposed rule .	severely	badly	seriously	heavily	gravely	extremely
however , the examination will be detailed if the applicant expressly requests it ( for example , at the same time as filing the Demand ) , or if the applicant files amendments and/or arguments ( for example , in response to the International Search Report , with the Demand or in response to a Written Opinion ; see below ) .	examination	investigation	inspection	scrutiny
from the previous examination last week the auto-immune deficiency could also be excluded .	examination	inspection	assesment	investigation	consultation
readers will appreciate this well-researched examination .	examination	investigation	analysis	enquiry	scrutiny
as well , he will continue his examination of the transatlantic connections that fuelled the slave trade .	examination	study	investigation	inspection	scrutiny	analysis
the US ranks 37th in a World Health Organization examination of the world 's health care systems .	examination	study	investigation	inspection	scrutiny
40 Among studies that found differences in procedure use in sex-discordant pairings , these differences have been seen largely in sex-specific services such as mammography screening , 25 , 35 , 39 prostate examination , 39 and pelvic examination or Papanicolaou smear testing , 25 , 35 , 39 selected procedures that may have produced differences in use rates because of their sex-specific nature .	examination	investigation	assessment	inspection	analysis
the photograph on the surface does not show a conflict or an irony , but with close examination , the punctum -the element which stands out and punctures the stadium -becomes apparent .	examination	analysis	inspection	scrutiny
examination questions , 1961-1965 Examination Questions , ca 1961-1965 , 30 cm ( c.1 , c.21 ) Examination question papers for various courses arranged alphabetically by subject and session .	examination	test	exam	assessment
examination leave also includes the mornings of days in which examinations are held in the afternoon as well as the time spent travelling to and from the examination centre .	examination	test	exam	assessment
i was given cardiovascular tests , including treadmill stress tests and ultrasound examinations of my heart , but apparently , things were n't bad enough that I was singled out for consultation .	examinations	ts	inspections	investigations
Galls indeed arise from the stinging of the plant tissues by the ovipositors of female gall wasps , and the egg laid in the plant tissues develops inside the gall into a grub , which eventually emerges full-grown and transformed into a mature gall wasp .	gall	pn
these include laparoscopic gall bladder surgery and reflux disease surgery , non-cardiac thoracoscopic chest surgery , and certain cardiotomy procedures such as mitral valve repair .	gall	pn
`` ( Adams , pp.196-9 ) What arrogance and gall it took to write those words and demand that they be spoken by Native tongues .	gall	nerve	cheek	audacity	impudence	temerity	effrontery
in the case of my gall bladder removal , I was out the next day .	gall	pn	bile-producing
even galls that formed on their trunks were eaten .	galls	gall	pustule	grub
come to my woman 's breasts , And take my milk for gall , you murdering ministers , Wherever in your sightless substances You wait on nature 's mischief !	gall	poison	bile	cheek	rancor
and the morans have the gall to ruin Beethoven 's 6th in the process , too .	gall	nerve	cheek	audacity	temerity	effrontery
Galls indeed arise from the stinging of the plant tissues by the ovipositors of female gall wasps , and the egg laid in the plant tissues develops inside the gall into a grub , which eventually emerges full-grown and transformed into a mature gall wasp .	galls	lists
in Boston Magazine 's glowing blurb on Via Matta , it had the extraordinary gall to say this : `` via Matta has unquestionably found its niche with Boston 's it crowd .	gall	nerve	cheek	audacity	temerity	effrontery
`` what is the world to do in the face of these grim predictions ?	grim	doomy	horrible	horrific	negative	severe	dire	bleak
`` He too can only watch in deepening despair as the grim work proceeds . '' Looks more like resignation to me , but AudioVision is not interested in letting us make up our own minds . `` Finally , the military police carry the crates away for disposal . '' No , they just take them away .	grim	unpleasant	terrible	horrific	horrible	unrelenting	gruesome
I 'd rather go face down , fast , in a plate of chili at 76 than suffer the grim attenuations of mental decay and wander off this mortal plane at 78 .	grim	unpleasant	terrible	bleak	dire	depressing	dismal	morbid
Vincent van Gogh in 1880 was a 27-year-old failure : a despised and rejected clergyman in a grim backwater mining town in Belgium .	grim	depressing	gloomy	harsh	bleak	horrid
hoarding and saving react with grim vengeance .	grim	dark	horrible	dire	horrific	sinister	unrelenting	ghastly
`` once that grim reality had sunk in , Kubrick 's response was an extraordinary tribute to sellers as an actor : `` we ca n't replace him with another actor , we 've got to get an authentic character from life , someone whose acting career is secondary-a real-life cowboy .	grim	awful	unpleasant	depressing	harsh	horrid	dismal
their trip had been a grim struggle with wet pitches , friable rock and bad bolts : they had reached the 1979 limit , but failed to go further .	grim	awful	gloomy	difficult	severe	harsh	unrelenting	harrowing
