women usually notice little change in their breasts , but if you are a man , your breasts may become slightly larger and may be tender .	tender	sore	sensitive	painful
`` i can be very , very strong , but on the other hand , I have very tender sentiments .	tender	kind	gentle	sympathetic
rabbits often feed on young , tender perennial growth as it emerges in spring , or on young transplants .	tender	soft
the grilled octopus was very tender .	tender	soft
Cook the rice , covered , over boiling water for about 30 minutes , or until the grains are tender .	tender	soft
they feed at that period on the opening buds of maples , and others that are equally tender and juicy .	tender	soft
Anne Bradstreet 's poetry is so tender and poignant , Cotton Mather 's preaching is both ornery and passionate , Richard Baxter 's Reformed Pastor is one of the classics , and Jonathan Edwards , is , well , Jonathan Edwards ( if you consider him a Puritan , not everyone does. ) Oh , by the way , great article about Puritans here .	tender	sensitive	gentle
China , India , Latin America and the rest of Asia will help grow worldwide demand for electric power by 59 percent over the next two decades . '' The hydrogen economy is based on the idea that fuel cells that run on hydrogen have the potential to replace current energy systems in all forms , from vehicle propulsion to stationary power generation to mobile phone batteries .	worldwide	global	international
this has been , at times , merely an effort to gain greater public renown for their group or cause , but more troubling have been the groups seeking to push forward al-Qaida 's agenda of worldwide terror .	worldwide	global	international
this is where the information revolution is happening -- and our share of these voices is smaller and smaller -- so America must find way to reach and engage a wider , younger , more diverse worldwide audience .	worldwide	global	international
that same thing could happen if we had a Manhattan type project focusing on renewables , potential worldwide markets , if we are the leader , and we have every reason to be the leader because we have the biggest problem .	worldwide	global	international
at the time of writing , the anti-semitic policies of the Soviet Union are also a subject of worldwide protest .	worldwide	global	international	universal
he suggested building an experimental hypertext ' web ' for the worldwide community of physicists who used CERN and its publications .	worldwide	global	international
furthermore , non-residents can apply to be treated like a resident if his/her income from German sources is either at least 90 percent of his/her worldwide income or his/her non-German source income is less than DM12,000 ( 24,000 for married couples ) .	worldwide	total	global	international
after adding the separate partnerships of JLW Ireland and JLW Scotland , the combined total of our European and North American businesses represented approximately 75 % of worldwide revenue in 1998 , up from approximately 63 % in 1997 .	worldwide	global	international
OSIS also provides its users with direct , yet protected , access to the Internet and its broad range of worldwide open source information resources .	worldwide	global	international
like Maypoles , wreaths too , as she points out , figure in May Day as well as Summer solstice celebrations . http : //www.schooloftheseasons.com/signssummer.html [ Link updated 5/20/02 ] [ Added 26 May 2000 ] : this fun page collects worldwide insights from people who write to Waverly and comment on how summer begins for them .	worldwide	global	international
these functions also use scheduling priority to decide which thread gets to execute when there is contention .	functions	activities	tasks	operations	sequences	subroutines
functions of the Presidency One way of bringing focus to the presidency is to determine what the functions of the position should be .	functions	jobs	roles
